{
  "$schema": "../../../../schemas/unit.schema.json",
  "id": "05-orchestration-quality-dataops",
  "title": "Orquestación Robusta, Calidad de Datos y DataOps",
  "officialTitle": "Data Orchestration, Quality Engineering & DataOps",
  "summary": "Orquestación moderna de pipelines con Apache Airflow: diseño de DAGs declarativos, programación idempotente basada en `logical_date`, prevención de sobrecargas de workers mediante sensores en modo `reschedule`, contratos de calidad con Great Expectations como circuit breakers y automatización CI/CD con DataOps.",
  "icon": "route",
  "color": "#8b5cf6",
  "objectives": [
    "Diseñar DAGs en Apache Airflow bajo el principio de idempotencia garantizando reprocesamientos históricos seguros.",
    "Configurar sensores en modo reschedule para eliminar la inanición de worker slots (starvation) y bloqueos en el cluster.",
    "Implementar contratos de datos y barreras de calidad automatizadas (Circuit Breakers) con Great Expectations antes de publicar en capas analíticas.",
    "Establecer flujos de integración y entrega continua (CI/CD) para pipelines de datos con pruebas estáticas y linters de SQL."
  ],
  "lessons": [
    "airflow-principios-dags-idempotencia",
    "sensores-reschedule-vs-poke-deadlocks",
    "calidad-datos-circuit-breakers-expectations",
    "dataops-ci-cd-infraestructura-codigo"
  ],
  "labs": [
    "lab-airflow-idempotent-dag",
    "lab-airflow-sensor-reschedule",
    "lab-data-quality-circuit-breaker"
  ],
  "quizPassRatio": 0.7,
  "quizQuestionCount": 10
}