{
  "$schema": "../../../../schemas/unit.schema.json",
  "id": "ingestion-storage-formats",
  "title": "Ingestión, Almacenamiento y Formatos de Datos",
  "officialTitle": "Data Ingestion, Storage & Formats",
  "summary": "Fundamentos de la adquisición y almacenamiento moderno: formatos columnares (Apache Parquet vs CSV/JSON), particionamiento de datos en almacenamiento de objetos (S3/GCS), técnicas de streaming de memoria con generadores en Python e ingestión de APIs tolerante a fallos.",
  "icon": "server",
  "color": "#0284c7",
  "objectives": [
    "Comparar el almacenamiento orientado a filas frente al orientado a columnas y justificar el ahorro de I/O y costo con Parquet y Snappy.",
    "Diseñar estrategias de particionamiento Hive en buckets S3 evitando el infame 'Small File Problem'.",
    "Construir pipelines de ingestión en Python que procesen archivos masivos con consumo de memoria acotado (<50MB RAM) mediante generadores.",
    "Implementar clientes de extracción HTTP con paginación por cursores, backoff exponencial con jitter y circuit breakers."
  ],
  "lessons": [
    "formatos-archivos-parquet-csv",
    "particionamiento-object-storage-s3",
    "python-generadores-memoria-eficiente",
    "extraccion-resiliente-backoff-cursores"
  ],
  "labs": [
    "lab-parquet-vs-csv-performance",
    "lab-streaming-generator-parser",
    "lab-api-backoff-jitter-extractor"
  ],
  "quizPassRatio": 0.7,
  "quizQuestionCount": 10
}