{
  "$schema": "../../../schemas/unit.schema.json",
  "id": "sistemas-distribuidos-bigdata",
  "title": "Sistemas Distribuidos y Big Data",
  "officialTitle": "Distributed Systems, Big Data & Apache Spark",
  "summary": "Escalabilidad masiva. Rompe las barreras físicas de la máquina única dominando los principios de la computación distribuida: el Teorema CAP, formatos columnares binarios (Apache Parquet con compresión Snappy/Zstd y Predicate Pushdown), almacenamiento en objetos (S3/MinIO), la revolución del Lakehouse transaccional ACID (Delta Lake / Apache Iceberg con Time Travel), y el motor de procesamiento distribuido estándar de la industria: Apache Spark (Catalyst Optimizer, mitigación de Data Skew, Salting y Broadcast Joins).",
  "icon": "server",
  "color": "#818cf8",
  "objectives": [
    "Dominar las leyes fundamentales de los sistemas distribuidos: Teorema CAP, particionamiento de red y modelos de consistencia.",
    "Comprender la física de los formatos columnares (Parquet, ORC) frente a formatos por filas (CSV, JSON), aprovechando compresión por diccionarios y Predicate Pushdown.",
    "Diseñar arquitecturas de Data Lakehouse transaccionales sobre almacenamiento de objetos utilizando Delta Lake y Apache Iceberg con capacidades de Time Travel y ACID.",
    "Comprender la arquitectura interna de Apache Spark: Driver, Executors, Catalyst Optimizer, DAG de etapas y Shuffles de red.",
    "Diagnosticar y mitigar cuellos de botella en Spark: Data Skew mediante Salting y optimización de JOINs asimétricos con Broadcast Hash Joins."
  ],
  "lessons": [
    "sistemas-distribuidos-formatos",
    "data-lakes-lakehouses-acid",
    "computo-distribuido-spark"
  ],
  "labs": [
    "parquet-compression-pushdown",
    "delta-lakehouse-time-travel",
    "spark-skew-salting-optimization"
  ],
  "quizPassRatio": 0.7,
  "quizQuestionCount": 10
}
