{
  "$schema": "../../../schemas/unit.schema.json",
  "id": "modelado-oltp-olap",
  "title": "Modelado Relacional, OLTP y OLAP",
  "officialTitle": "Relational Modeling, OLTP & Data Warehousing",
  "summary": "Estructuración lógica de datos. Aprende dónde y cómo se guardan los datos para escritura transaccional rápida (OLTP) frente a lectura analítica masiva (OLAP): normalización (1NF a 3NF), garantías ACID, planes de ejecución con EXPLAIN ANALYZE, índices B-Tree compuestos, SQL analítico avanzado con CTEs y Funciones de Ventana (LAG, LEAD, ROW_NUMBER), y diseño dimensional de Data Warehouse con Esquema en Estrella y Dimensiones Lentamente Cambiantes (SCD Tipo 2).",
  "icon": "layers",
  "color": "#fbbf24",
  "objectives": [
    "Diseñar esquemas normalizados (1NF a 3NF) para sistemas transaccionales eliminando anomalías de modificación y redundancia.",
    "Comprender las garantías ACID y optimizar consultas en PostgreSQL analizando el costo de planes de ejecución con EXPLAIN ANALYZE.",
    "Dominar SQL analítico avanzado utilizando CTEs y funciones de ventana para cohortes, retención y cálculos de deltas sin descargar datos a Python.",
    "Modelar arquitecturas de Data Warehouse mediante Esquemas en Estrella (Star Schema), distinguiendo tablas de hechos y dimensiones.",
    "Implementar Dimensiones Lentamente Cambiantes (SCD Tipo 2) con claves subrogadas, fechas de vigencia (valid_from/valid_to) y banderas de registro activo."
  ],
  "lessons": [
    "oltp-motores-transaccionales",
    "sql-analitico-funciones-ventana",
    "modelado-dimensional-dwh"
  ],
  "labs": [
    "postgres-indexing-explain-analyze",
    "window-functions-cohort-retention",
    "star-schema-scd-type-2"
  ],
  "quizPassRatio": 0.7,
  "quizQuestionCount": 10
}
